filename	date	chars	title	url
2026-02-28_remarks_announcing_major_combat_operations_in_iran.txt	February 28, 2026	6160	Remarks Announcing Major Combat Operations in Iran	https://www.presidency.ucsb.edu/documents/remarks-announcing-major-combat-operations-iran
2026-02-25_white_house_press_release_what_they_are_saying_president_trump_heralds_america_s_golden_age_in_historic_state_of_the_uni.txt	February 25, 2026	83404	White House Press Release - WHAT THEY ARE SAYING: President Trump Heralds America's Golden Age in Historic State of the Union Address	https://www.presidency.ucsb.edu/documents/white-house-press-release-what-they-are-saying-president-trump-heralds-americas-golden-age
2026-02-25_white_house_press_release_president_trump_delivers_his_2026_state_of_the_union_address.txt	February 25, 2026	2347	White House Press Release - President Trump Delivers his 2026 State of the Union Address	https://www.presidency.ucsb.edu/documents/white-house-press-release-president-trump-delivers-his-2026-state-the-union-address
2026-02-24_address_before_a_joint_session_of_the_congress_on_the_state_of_the_union.txt	February 24, 2026	60025	Address Before a Joint Session of the Congress on the State of the Union	https://www.presidency.ucsb.edu/documents/address-before-joint-session-the-congress-the-state-the-union-31
2026-02-20_remarks_by_director_of_the_white_house_office_of_science_and_technology_policy_michael_kratsios_at_the_india_ai_impact_s.txt	February 20, 2026	11992	Remarks by Director of the White House Office of Science and Technology Policy Michael Kratsios at the India AI Impact Summit in New Delhi, India	https://www.presidency.ucsb.edu/documents/remarks-director-the-white-house-office-science-and-technology-policy-michael-kratsios-the
2026-02-20_white_house_fact_sheet_president_donald_j_trump_imposes_a_temporary_import_duty_to_address_fundamental_international_pay.txt	February 20, 2026	7853	White House Fact Sheet: President Donald J. Trump Imposes a Temporary Import Duty to Address Fundamental International Payment Problems	https://www.presidency.ucsb.edu/documents/white-house-fact-sheet-president-donald-j-trump-imposes-temporary-import-duty-address
2026-02-20_proclamation_11012_imposing_a_temporary_import_surcharge_to_address_fundamental_international_payments_problems.txt	February 20, 2026	20274	Proclamation 11012—Imposing a Temporary Import Surcharge to Address Fundamental International Payments Problems	https://www.presidency.ucsb.edu/documents/proclamation-11012-imposing-temporary-import-surcharge-address-fundamental-international
2026-02-10_white_house_press_release_voter_id_is_overwhelmingly_popular_with_literally_everyone_except_democrat_politicians.txt	February 10, 2026	2262	White House Press Release - Voter ID Is Overwhelmingly Popular with Literally Everyone — Except Democrat Politicians	https://www.presidency.ucsb.edu/documents/white-house-press-release-voter-id-overwhelmingly-popular-with-literally-everyone-except
2026-02-06_white_house_fact_sheet_president_donald_j_trump_addresses_threats_to_the_united_states_by_the_government_of_iran.txt	February 06, 2026	3822	White House Fact Sheet: President Donald J. Trump Addresses Threats to the United States by the Government of Iran	https://www.presidency.ucsb.edu/documents/white-house-fact-sheet-president-donald-j-trump-addresses-threats-the-united-states-the-1
2026-02-06_executive_order_14382_addressing_threats_to_the_united_states_by_the_government_of_iran.txt	February 06, 2026	12546	Executive Order 14382—Addressing Threats to the United States by the Government of Iran	https://www.presidency.ucsb.edu/documents/executive-order-14382-addressing-threats-the-united-states-the-government-iran
2026-02-06_executive_order_14384_modifying_duties_to_address_threats_to_the_united_states_by_the_government_of_the_russian_federati.txt	February 06, 2026	7323	Executive Order 14384—Modifying Duties to Address Threats to the United States by the Government of the Russian Federation	https://www.presidency.ucsb.edu/documents/executive-order-14384-modifying-duties-address-threats-the-united-states-the-government
2026-02-05_white_house_press_release_president_trump_showcases_historic_successes_future_vision_in_exclusive_nbc_interview.txt	February 05, 2026	5596	White House Press Release - President Trump Showcases Historic Successes, Future Vision in Exclusive NBC Interview	https://www.presidency.ucsb.edu/documents/white-house-press-release-president-trump-showcases-historic-successes-future-vision
2026-01-29_white_house_fact_sheet_president_donald_j_trump_launches_the_great_american_recovery_initiative_to_address_the_addiction.txt	January 29, 2026	5141	White House Fact Sheet: President Donald J. Trump Launches the Great American Recovery Initiative to Address the Addiction Crisis	https://www.presidency.ucsb.edu/documents/white-house-fact-sheet-president-donald-j-trump-launches-the-great-american-recovery
2026-01-29_white_house_fact_sheet_president_donald_j_trump_addresses_threats_to_the_united_states_by_the_government_of_cuba.txt	January 29, 2026	3676	White House Fact Sheet: President Donald J. Trump Addresses Threats to the United States by the Government of Cuba	https://www.presidency.ucsb.edu/documents/white-house-fact-sheet-president-donald-j-trump-addresses-threats-the-united-states-the-0
2026-01-29_executive_order_14379_addressing_addiction_through_the_great_american_recovery_initiative.txt	January 29, 2026	6685	Executive Order 14379—Addressing Addiction Through the Great American Recovery Initiative	https://www.presidency.ucsb.edu/documents/executive-order-14379-addressing-addiction-through-the-great-american-recovery-initiative
2026-01-29_executive_order_14380_addressing_threats_to_the_united_states_by_the_government_of_cuba.txt	January 29, 2026	14336	Executive Order 14380—Addressing Threats to the United States by the Government of Cuba	https://www.presidency.ucsb.edu/documents/executive-order-14380-addressing-threats-the-united-states-the-government-cuba
2026-01-27_white_house_fact_sheet_president_donald_j_trump_addresses_state_and_local_failures_to_rebuild_los_angeles_after_wildfire.txt	January 27, 2026	4027	White House Fact Sheet: President Donald J. Trump Addresses State and Local Failures to Rebuild Los Angeles After Wildfire Disasters	https://www.presidency.ucsb.edu/documents/white-house-fact-sheet-president-donald-j-trump-addresses-state-and-local-failures-rebuild
2026-01-27_remarks_in_an_exchange_with_reporters_in_urbandale_iowa.txt	January 27, 2026	14590	Remarks in an Exchange With Reporters in Urbandale, Iowa	https://www.presidency.ucsb.edu/documents/remarks-exchange-with-reporters-urbandale-iowa
2026-01-27_remarks_and_an_exchange_with_reporters_prior_to_departure_for_des_moines_iowa.txt	January 27, 2026	7493	Remarks and an Exchange With Reporters Prior to Departure for Des Moines, Iowa	https://www.presidency.ucsb.edu/documents/remarks-and-exchange-with-reporters-prior-departure-for-des-moines-iowa
2026-01-27_remarks_in_clive_iowa.txt	January 27, 2026	50378	Remarks in Clive, Iowa	https://www.presidency.ucsb.edu/documents/remarks-clive-iowa
2026-01-23_executive_order_14377_addressing_state_and_local_failures_to_rebuild_los_angeles_after_wildfire_disasters.txt	January 23, 2026	10779	Executive Order 14377—Addressing State and Local Failures To Rebuild Los Angeles After Wildfire Disasters	https://www.presidency.ucsb.edu/documents/executive-order-14377-addressing-state-and-local-failures-rebuild-los-angeles-after
2026-01-22_remarks_and_an_exchange_with_reporters_aboard_air_force_one_en_route_to_joint_base_andrews_maryland.txt	January 22, 2026	31171	Remarks and an Exchange With Reporters Aboard Air Force One En Route to Joint Base Andrews, Maryland	https://www.presidency.ucsb.edu/documents/remarks-and-exchange-with-reporters-aboard-air-force-one-en-route-joint-base-andrews-4
2026-01-21_remarks_during_a_meeting_with_secretary_general_mark_rutte_of_the_north_atlantic_treaty_organization_and_an_exchange_wit.txt	January 21, 2026	6266	Remarks During a Meeting With Secretary General Mark Rutte of the North Atlantic Treaty Organization and an Exchange With Reporters in Davos, Switzerland	https://www.presidency.ucsb.edu/documents/remarks-during-meeting-with-secretary-general-mark-rutte-the-north-atlantic-treaty
2026-01-21_remarks_during_a_meeting_with_president_abdelfattah_said_elsisi_of_egypt_and_an_exchange_with_reporters_in_davos_switzer.txt	January 21, 2026	8912	Remarks During a Meeting With President Abdelfattah Said Elsisi of Egypt and an Exchange With Reporters in Davos, Switzerland	https://www.presidency.ucsb.edu/documents/remarks-during-meeting-with-president-abdelfattah-said-elsisi-egypt-and-exchange-with-0
2026-01-21_remarks_during_a_world_economic_forum_reception_with_business_leaders_in_davos_switzerland.txt	January 21, 2026	16098	Remarks During a World Economic Forum Reception With Business Leaders in Davos, Switzerland	https://www.presidency.ucsb.edu/documents/remarks-during-world-economic-forum-reception-with-business-leaders-davos-switzerland
2026-01-21_remarks_and_a_question_and_answer_session_at_the_world_economic_forum_in_davos_switzerland.txt	January 21, 2026	82819	Remarks and a Question-and-Answer Session at the World Economic Forum in Davos, Switzerland	https://www.presidency.ucsb.edu/documents/remarks-and-question-and-answer-session-the-world-economic-forum-davos-switzerland-0
2026-01-21_remarks_prior_to_a_meeting_with_president_guy_parmelin_of_switzerland_and_an_exchange_with_reporters_in_davos_switzerlan.txt	January 21, 2026	3708	Remarks Prior to a Meeting With President Guy Parmelin of Switzerland and an Exchange With Reporters in Davos, Switzerland	https://www.presidency.ucsb.edu/documents/remarks-prior-meeting-with-president-guy-parmelin-switzerland-and-exchange-with-reporters
2026-01-20_remarks_during_a_press_briefing_with_white_house_press_secretary_karoline_leavitt_and_an_exchange_with_reporters.txt	January 20, 2026	100049	Remarks During a Press Briefing With White House Press Secretary Karoline Leavitt and an Exchange With Reporters	https://www.presidency.ucsb.edu/documents/remarks-during-press-briefing-with-white-house-press-secretary-karoline-leavitt-and
2026-01-19_remarks_and_an_exchange_with_reporters_prior_to_departure_from_west_palm_beach_florida.txt	January 19, 2026	7522	Remarks and an Exchange With Reporters Prior to Departure From West Palm Beach, Florida	https://www.presidency.ucsb.edu/documents/remarks-and-exchange-with-reporters-prior-departure-from-west-palm-beach-florida-0
2026-01-16_remarks_in_an_exchange_with_reporters_prior_to_departure_for_palm_beach_florida.txt	January 16, 2026	6118	Remarks in an Exchange With Reporters Prior to Departure for Palm Beach, Florida	https://www.presidency.ucsb.edu/documents/remarks-exchange-with-reporters-prior-departure-for-palm-beach-florida-1
2026-01-16_remarks_at_a_roundtable_discussion_on_rural_health_care_improvement_efforts.txt	January 16, 2026	52857	Remarks at a Roundtable Discussion on Rural Health Care Improvement Efforts	https://www.presidency.ucsb.edu/documents/remarks-roundtable-discussion-rural-health-care-improvement-efforts
2026-01-16_remarks_at_a_dedication_ceremony_for_the_southern_boulevard_in_palm_beach_florida.txt	January 16, 2026	25686	Remarks at a Dedication Ceremony for the Southern Boulevard in Palm Beach, Florida	https://www.presidency.ucsb.edu/documents/remarks-dedication-ceremony-for-the-southern-boulevard-palm-beach-florida
2026-01-15_remarks_honoring_the_2025_stanley_cup_champion_florida_panthers.txt	January 15, 2026	16567	Remarks Honoring the 2025 Stanley Cup Champion Florida Panthers	https://www.presidency.ucsb.edu/documents/remarks-honoring-the-2025-stanley-cup-champion-florida-panthers
2026-01-14_remarks_on_signing_the_whole_milk_for_healthy_kids_act_of_2025_and_an_exchange_with_reporters.txt	January 14, 2026	49669	Remarks on Signing the Whole Milk for Healthy Kids Act of 2025 and an Exchange With Reporters	https://www.presidency.ucsb.edu/documents/remarks-signing-the-whole-milk-for-healthy-kids-act-2025-and-exchange-with-reporters
2026-01-13_remarks_and_an_exchange_with_reporters_prior_to_departure_for_dearborn_michigan.txt	January 13, 2026	3221	Remarks and an Exchange With Reporters Prior to Departure for Dearborn, Michigan	https://www.presidency.ucsb.edu/documents/remarks-and-exchange-with-reporters-prior-departure-for-dearborn-michigan
2026-01-13_remarks_during_a_tour_of_the_ford_river_rouge_complex_and_an_exchange_with_reporters_in_dearborn_michigan.txt	January 13, 2026	11138	Remarks During a Tour of the Ford River Rouge Complex and an Exchange With Reporters in Dearborn, Michigan	https://www.presidency.ucsb.edu/documents/remarks-during-tour-the-ford-river-rouge-complex-and-exchange-with-reporters-dearborn
2026-01-13_remarks_and_an_exchange_with_reporters_at_joint_base_andrews_maryland.txt	January 13, 2026	9731	Remarks and an Exchange With Reporters at Joint Base Andrews, Maryland	https://www.presidency.ucsb.edu/documents/remarks-and-exchange-with-reporters-joint-base-andrews-maryland-11
2026-01-13_remarks_to_the_detroit_economic_club_in_detroit_michigan.txt	January 13, 2026	62679	Remarks to the Detroit Economic Club in Detroit, Michigan	https://www.presidency.ucsb.edu/documents/remarks-the-detroit-economic-club-detroit-michigan-1
2026-01-11_remarks_in_an_exchange_with_reporters_aboard_air_force_one_en_route_to_joint_base_andrews_maryland.txt	January 11, 2026	24818	Remarks in an Exchange With Reporters Aboard Air Force One En Route to Joint Base Andrews, Maryland	https://www.presidency.ucsb.edu/documents/remarks-exchange-with-reporters-aboard-air-force-one-en-route-joint-base-andrews-11
2026-01-09_remarks_and_an_exchange_with_reporters_prior_to_departure_for_palm_beach_florida.txt	January 09, 2026	2411	Remarks and an Exchange With Reporters Prior to Departure for Palm Beach, Florida	https://www.presidency.ucsb.edu/documents/remarks-and-exchange-with-reporters-prior-departure-for-palm-beach-florida-0
2026-01-09_remarks_during_a_meeting_with_executives_of_oil_and_gas_companies_and_an_exchange_with_reporters.txt	January 09, 2026	87437	Remarks During a Meeting With Executives of Oil and Gas Companies and an Exchange With Reporters	https://www.presidency.ucsb.edu/documents/remarks-during-meeting-with-executives-oil-and-gas-companies-and-exchange-with-reporters
2026-01-07_interview_with_zolan_kanno_youngs_tyler_pager_katie_rogers_and_david_e_sanger_of_the_new_york_times.txt	January 07, 2026	124325	Interview with Zolan Kanno-Youngs, Tyler Pager, Katie Rogers, and David E. Sanger of the New York Times	https://www.presidency.ucsb.edu/documents/interview-with-zolan-kanno-youngs-tyler-pager-katie-rogers-and-david-e-sanger-the-new-york
2026-01-06_remarks_at_the_house_republican_members_retreat.txt	January 06, 2026	79472	Remarks at the House Republican Members Retreat	https://www.presidency.ucsb.edu/documents/remarks-the-house-republican-members-retreat
2026-01-04_remarks_in_an_exchange_with_reporters_aboard_air_force_one_en_route_to_joint_base_andrews_maryland.txt	January 04, 2026	44719	Remarks in an Exchange With Reporters Aboard Air Force One En Route to Joint Base Andrews, Maryland	https://www.presidency.ucsb.edu/documents/remarks-exchange-with-reporters-aboard-air-force-one-en-route-joint-base-andrews-10
2026-01-03_the_president_s_news_conference_in_palm_beach_florida.txt	January 03, 2026	57394	The President's News Conference in Palm Beach, Florida	https://www.presidency.ucsb.edu/documents/the-presidents-news-conference-palm-beach-florida
2025-12-31_remarks_at_a_new_year_s_eve_party_and_an_exchange_with_reporters_in_palm_beach_florida.txt	December 31, 2025	10639	Remarks at a New Year's Eve Party and an Exchange With Reporters in Palm Beach, Florida	https://www.presidency.ucsb.edu/documents/remarks-new-years-eve-party-and-exchange-with-reporters-palm-beach-florida
2025-12-29_remarks_in_an_exchange_with_reporters_during_a_greeting_with_prime_minister_benjamin_netanyahu_of_israel_in_palm_beach_f.txt	December 29, 2025	18175	Remarks in an Exchange With Reporters During a Greeting With Prime Minister Benjamin Netanyahu of Israel in Palm Beach, Florida	https://www.presidency.ucsb.edu/documents/remarks-exchange-with-reporters-during-greeting-with-prime-minister-benjamin-netanyahu
2025-12-29_the_president_s_news_conference_with_prime_minister_benjamin_netanyahu_of_israel_in_palm_beach_florida.txt	December 29, 2025	27989	The President's News Conference With Prime Minister Benjamin Netanyahu of Israel in Palm Beach, Florida	https://www.presidency.ucsb.edu/documents/the-presidents-news-conference-with-prime-minister-benjamin-netanyahu-israel-palm-beach
2025-12-28_remarks_in_an_exchange_with_reporters_during_a_greeting_with_president_volodymyr_zelenskyy_of_ukraine_in_palm_beach_flor.txt	December 28, 2025	7263	Remarks in an Exchange With Reporters During a Greeting With President Volodymyr Zelenskyy of Ukraine in Palm Beach, Florida	https://www.presidency.ucsb.edu/documents/remarks-exchange-with-reporters-during-greeting-with-president-volodymyr-zelenskyy-ukraine
2025-12-28_the_president_s_news_conference_with_president_volodymyr_zelenskyy_of_ukraine_in_palm_beach_florida.txt	December 28, 2025	25135	The President's News Conference With President Volodymyr Zelenskyy of Ukraine in Palm Beach, Florida	https://www.presidency.ucsb.edu/documents/the-presidents-news-conference-with-president-volodymyr-zelenskyy-ukraine-palm-beach
2025-12-24_remarks_during_a_christmas_eve_telephone_call_with_deployed_united_states_servicemembers_from_palm_beach_florida.txt	December 24, 2025	8579	Remarks During a Christmas Eve Telephone Call With Deployed United States Servicemembers From Palm Beach, Florida	https://www.presidency.ucsb.edu/documents/remarks-during-christmas-eve-telephone-call-with-deployed-united-states-servicemembers
2025-12-22_remarks_on_united_states_naval_ship_development_and_an_exchange_with_reporters_in_palm_beach_florida.txt	December 22, 2025	50648	Remarks on United States Naval Ship Development and an Exchange With Reporters in Palm Beach, Florida	https://www.presidency.ucsb.edu/documents/remarks-united-states-naval-ship-development-and-exchange-with-reporters-palm-beach
2025-12-21_telephone_remarks_at_turning_point_u_s_a_s_americafest_conference_in_phoenix_arizona.txt	December 21, 2025	2369	Telephone Remarks at Turning Point U.S.A.'s AmericaFest Conference in Phoenix, Arizona	https://www.presidency.ucsb.edu/documents/telephone-remarks-turning-point-usas-americafest-conference-phoenix-arizona
2025-12-19_remarks_on_efforts_to_reduce_prescription_drug_prices.txt	December 19, 2025	44776	Remarks on Efforts To Reduce Prescription Drug Prices	https://www.presidency.ucsb.edu/documents/remarks-efforts-reduce-prescription-drug-prices
2025-12-19_remarks_prior_to_departure_for_rocky_mount_north_carolina.txt	December 19, 2025	939	Remarks Prior to Departure for Rocky Mount, North Carolina	https://www.presidency.ucsb.edu/documents/remarks-prior-departure-for-rocky-mount-north-carolina
2025-12-19_remarks_on_the_national_economy_in_rocky_mount_north_carolina.txt	December 19, 2025	77095	Remarks on the National Economy in Rocky Mount, North Carolina	https://www.presidency.ucsb.edu/documents/remarks-the-national-economy-rocky-mount-north-carolina
2025-12-18_white_house_press_release_president_trump_highlights_america_s_historic_comeback_in_year_end_address.txt	December 18, 2025	3904	White House Press Release - President Trump Highlights America's Historic Comeback in Year-End Address	https://www.presidency.ucsb.edu/documents/white-house-press-release-president-trump-highlights-americas-historic-comeback-year-end
2025-12-18_remarks_on_signing_an_executive_order_on_increasing_medical_marijuana_and_cannabidiol_research_and_an_exchange_with_repo.txt	December 18, 2025	35366	Remarks on Signing an Executive Order on Increasing Medical Marijuana and Cannabidiol Research and an Exchange With Reporters	https://www.presidency.ucsb.edu/documents/remarks-signing-executive-order-increasing-medical-marijuana-and-cannabidiol-research-and
2025-12-17_remarks_and_an_exchange_with_reporters_upon_arrival_at_joint_base_andrews_maryland.txt	December 17, 2025	1965	Remarks and an Exchange With Reporters Upon Arrival at Joint Base Andrews, Maryland	https://www.presidency.ucsb.edu/documents/remarks-and-exchange-with-reporters-upon-arrival-joint-base-andrews-maryland-2
2025-12-17_address_to_the_nation_on_the_economy.txt	December 17, 2025	15386	Address to the Nation on the Economy	https://www.presidency.ucsb.edu/documents/address-the-nation-the-economy-1
2025-12-16_remarks_at_a_hanukkah_reception.txt	December 16, 2025	39076	Remarks at a Hanukkah Reception	https://www.presidency.ucsb.edu/documents/remarks-hanukkah-reception-12
2025-12-15_remarks_on_presenting_the_mexican_border_defense_medal_and_an_exchange_with_reporters.txt	December 15, 2025	43355	Remarks on Presenting the Mexican Border Defense Medal and an Exchange With Reporters	https://www.presidency.ucsb.edu/documents/remarks-presenting-the-mexican-border-defense-medal-and-exchange-with-reporters
2025-12-14_remarks_at_a_christmas_reception.txt	December 14, 2025	41104	Remarks at a Christmas Reception	https://www.presidency.ucsb.edu/documents/remarks-christmas-reception
2025-12-13_remarks_in_an_exchange_with_reporters_prior_to_departure_for_baltimore_maryland.txt	December 13, 2025	1051	Remarks in an Exchange With Reporters Prior to Departure for Baltimore, Maryland	https://www.presidency.ucsb.edu/documents/remarks-exchange-with-reporters-prior-departure-for-baltimore-maryland-1
2025-12-12_remarks_on_signing_the_miracle_on_ice_congressional_gold_medal_act_and_an_exchange_with_reporters.txt	December 12, 2025	47898	Remarks on Signing the Miracle on Ice Congressional Gold Medal Act and an Exchange With Reporters	https://www.presidency.ucsb.edu/documents/remarks-signing-the-miracle-ice-congressional-gold-medal-act-and-exchange-with-reporters
2025-12-11_remarks_on_signing_an_executive_order_ensuring_a_national_policy_framework_for_artificial_intelligence_and_an_exchange_w.txt	December 11, 2025	31053	Remarks on Signing an Executive Order Ensuring a National Policy Framework for Artificial Intelligence and an Exchange With Reporters	https://www.presidency.ucsb.edu/documents/remarks-signing-executive-order-ensuring-national-policy-framework-for-artificial
2025-12-11_remarks_at_the_congressional_ball.txt	December 11, 2025	19128	Remarks at the Congressional Ball	https://www.presidency.ucsb.edu/documents/remarks-the-congressional-ball-1
2025-12-10_remarks_during_a_roundtable_discussion_with_business_leaders_and_an_exchange_with_reporters.txt	December 10, 2025	73456	Remarks During a Roundtable Discussion With Business Leaders and an Exchange With Reporters	https://www.presidency.ucsb.edu/documents/remarks-during-roundtable-discussion-with-business-leaders-and-exchange-with-reporters
2025-12-09_white_house_press_release_president_trump_s_politico_interview_democrats_lost_control_i_took_it_back.txt	December 09, 2025	3959	White House Press Release - President Trump's Politico Interview: Democrats Lost Control — I Took it Back	https://www.presidency.ucsb.edu/documents/white-house-press-release-president-trumps-politico-interview-democrats-lost-control-i
2025-12-09_remarks_in_an_exchange_with_reporters_aboard_air_force_one_en_route_to_avoca_pennsylvania.txt	December 09, 2025	3531	Remarks in an Exchange With Reporters Aboard Air Force One En Route to Avoca, Pennsylvania	https://www.presidency.ucsb.edu/documents/remarks-exchange-with-reporters-aboard-air-force-one-en-route-avoca-pennsylvania
2025-12-09_remarks_on_the_national_economy_in_mount_pocono_pennsylvania.txt	December 09, 2025	86559	Remarks on the National Economy in Mount Pocono, Pennsylvania	https://www.presidency.ucsb.edu/documents/remarks-the-national-economy-mount-pocono-pennsylvania
2025-12-08_remarks_in_a_roundtable_discussion_on_federal_relief_for_farmers_and_an_exchange_with_reporters.txt	December 08, 2025	65164	Remarks in a Roundtable Discussion on Federal Relief for Farmers and an Exchange With Reporters	https://www.presidency.ucsb.edu/documents/remarks-roundtable-discussion-federal-relief-for-farmers-and-exchange-with-reporters
2025-12-07_remarks_in_an_exchange_with_reporters_prior_to_the_kennedy_center_honors_ceremony.txt	December 07, 2025	29109	Remarks in an Exchange With Reporters Prior to the Kennedy Center Honors Ceremony	https://www.presidency.ucsb.edu/documents/remarks-exchange-with-reporters-prior-the-kennedy-center-honors-ceremony
2025-12-07_remarks_at_the_kennedy_center_honors_ceremony.txt	December 07, 2025	12747	Remarks at the Kennedy Center Honors Ceremony	https://www.presidency.ucsb.edu/documents/remarks-the-kennedy-center-honors-ceremony
2025-12-06_white_house_fact_sheet_president_donald_j_trump_addresses_security_risks_from_price_fixing_and_anti_competitive_behavior.txt	December 06, 2025	3618	White House Fact Sheet: President Donald J. Trump Addresses Security Risks from Price Fixing and Anti-Competitive Behavior in the Food Supply Chain	https://www.presidency.ucsb.edu/documents/white-house-fact-sheet-president-donald-j-trump-addresses-security-risks-from-price-fixing
2025-12-06_executive_order_14364_addressing_security_risks_from_price_fixing_and_anti_competitive_behavior_in_the_food_supply_chain.txt	December 06, 2025	4210	Executive Order 14364—Addressing Security Risks From Price Fixing and Anti-Competitive Behavior in the Food Supply Chain	https://www.presidency.ucsb.edu/documents/executive-order-14364-addressing-security-risks-from-price-fixing-and-anti-competitive
2025-12-06_remarks_on_presenting_the_2025_kennedy_center_honoree_medals.txt	December 06, 2025	8378	Remarks on Presenting the 2025 Kennedy Center Honoree Medals	https://www.presidency.ucsb.edu/documents/remarks-presenting-the-2025-kennedy-center-honoree-medals
